<?xml version="1.0" encoding="UTF-8"?>
<!--

       Copyright 2006-2016 the original author or authors.

       Licensed under the Apache License, Version 2.0 (the "License");
       you may not use this file except in compliance with the License.
       You may obtain a copy of the License at

          http://www.apache.org/licenses/LICENSE-2.0

       Unless required by applicable law or agreed to in writing, software
       distributed under the License is distributed on an "AS IS" BASIS,
       WITHOUT WARRANTIES OR CONDITIONS OF ANY KIND, either express or implied.
       See the License for the specific language governing permissions and
       limitations under the License.

-->
<!DOCTYPE ibatorConfiguration
  PUBLIC "-//Apache Software Foundation//DTD Apache iBATIS Ibator Configuration 1.0//EN"
  "http://ibatis.apache.org/dtd/ibator-config_1_0.dtd">

<ibatorConfiguration>
  
  <ibatorContext id="FlatJava2" targetRuntime="Ibatis2Java2" defaultModelType="flat">
    <ibatorPlugin type="org.mybatis.generator.plugins.EqualsHashCodePlugin" />
    <ibatorPlugin type="org.mybatis.generator.plugins.SqlMapConfigPlugin" >
      <property name="targetPackage" value="mbg.test.ib2j2.generated.flat" />
      <property name="targetProject" value="MAVEN" />
    </ibatorPlugin>
    
    <jdbcConnection driverClass="org.hsqldb.jdbcDriver"
        connectionURL="jdbc:hsqldb:mem:aname"
        userId="sa" />

    <javaModelGenerator targetPackage="mbg.test.ib2j2.generated.flat.model" targetProject="MAVEN">
      <property name="enableSubPackages" value="true" />
      <property name="trimStrings" value="true" />
    </javaModelGenerator>

    <sqlMapGenerator targetPackage="mbg.test.ib2j2.generated.flat.xml"  targetProject="MAVEN">
      <property name="enableSubPackages" value="true" />
    </sqlMapGenerator>

    <daoGenerator type="GENERIC-SI" targetPackage="mbg.test.ib2j2.generated.flat.dao"  targetProject="MAVEN">
      <property name="enableSubPackages" value="true" />
    </daoGenerator>

    <table tableName="FieldsOnly" />
    <table tableName="PKOnly" />
    <table tableName="PKFields" alias="B" >
      <columnOverride column="wierd$Field" delimitedColumnName="true"/>
      <columnOverride column="stringBoolean" javaType="boolean" typeHandler="mbg.test.ib2j2.common.StringBooleanTypeHandler"/>
    </table>
    <table tableName="PKBlobs" />
    <table tableName="PKFieldsBlobs" />
    <table tableName="FieldsBlobs" />
    <table tableName="awful table" alias="A">
      <property name="useColumnIndexes" value="true"/>
      <generatedKey column="CuStOmEr iD" sqlStatement="HSQLDB" identity="true" />
      <columnOverride column="first name" property="firstFirstName" />
      <columnOverride column="first_name" property="secondFirstName" />
      <columnOverride column="firstName" property="thirdFirstName" />
      <columnOverride column="from" delimitedColumnName="true" />
      <columnOverride column="active" javaType="boolean" />
      <columnOverride column="_id1" delimitedColumnName="true" />
      <columnOverride column="$id2" delimitedColumnName="true" />
      <columnOverride column="id5_" delimitedColumnName="true" />
      <columnOverride column="id6$" delimitedColumnName="true" />
      <columnOverride column="id7$$" delimitedColumnName="true" />
      <columnOverride column="class" property="dbClass" />
    </table>
  </ibatorContext>

  <ibatorContext id="HierarchicalJava2" targetRuntime="Ibatis2Java2" defaultModelType="hierarchical">
    <ibatorPlugin type="org.mybatis.generator.plugins.EqualsHashCodePlugin" />

    <jdbcConnection driverClass="org.hsqldb.jdbcDriver"
        connectionURL="jdbc:hsqldb:mem:aname"
        userId="sa" />

    <javaModelGenerator targetPackage="mbg.test.ib2j2.generated.hierarchical.model" targetProject="MAVEN">
      <property name="enableSubPackages" value="true" />
      <property name="trimStrings" value="true" />
    </javaModelGenerator>

    <sqlMapGenerator targetPackage="mbg.test.ib2j2.generated.hierarchical.xml"  targetProject="MAVEN">
      <property name="enableSubPackages" value="true" />
    </sqlMapGenerator>

    <daoGenerator type="GENERIC-CI" targetPackage="mbg.test.ib2j2.generated.hierarchical.dao"  targetProject="MAVEN">
      <property name="enableSubPackages" value="true" />
    </daoGenerator>

    <table tableName="FieldsOnly" domainObjectName="subpackage.Fieldsonly" />
    <table tableName="PKOnly" />
    <table tableName="PKFields" alias="B" >
      <columnOverride column="wierd$Field" delimitedColumnName="true"/>
    </table>
    <table tableName="PKBlobs" />
    <table tableName="PKFieldsBlobs" />
    <table tableName="FieldsBlobs" />
    <table tableName="awful table" alias="A">
      <property name="useColumnIndexes" value="true"/>
      <generatedKey column="CuStOmEr iD" sqlStatement="HSQLDB" identity="true" />
      <columnOverride column="first name" property="firstFirstName" />
      <columnOverride column="first_name" property="secondFirstName" />
      <columnOverride column="firstName" property="thirdFirstName" />
      <columnOverride column="from" delimitedColumnName="true" />
      <columnOverride column="active" javaType="boolean" />
      <columnOverride column="_id1" delimitedColumnName="true" />
      <columnOverride column="$id2" delimitedColumnName="true" />
      <columnOverride column="id5_" delimitedColumnName="true" />
      <columnOverride column="id6$" delimitedColumnName="true" />
      <columnOverride column="id7$$" delimitedColumnName="true" />
      <columnOverride column="class" property="dbClass" />
    </table>
  </ibatorContext>

  <ibatorContext id="ConditionalJava2" targetRuntime="Ibatis2Java2" defaultModelType="conditional">
    <ibatorPlugin type="org.mybatis.generator.plugins.EqualsHashCodePlugin" />

    <jdbcConnection driverClass="org.hsqldb.jdbcDriver"
        connectionURL="jdbc:hsqldb:mem:aname"
        userId="sa" />

    <javaModelGenerator targetPackage="mbg.test.ib2j2.generated.conditional.model" targetProject="MAVEN">
      <property name="enableSubPackages" value="true" />
      <property name="trimStrings" value="true" />
    </javaModelGenerator>

    <sqlMapGenerator targetPackage="mbg.test.ib2j2.generated.conditional.xml"  targetProject="MAVEN">
      <property name="enableSubPackages" value="true" />
    </sqlMapGenerator>

    <daoGenerator type="SPRING" targetPackage="mbg.test.ib2j2.generated.conditional.dao"  targetProject="MAVEN">
      <property name="enableSubPackages" value="true" />
    </daoGenerator>

    <table tableName="FieldsOnly" />
    <table tableName="PKOnly" />
    <table tableName="PKFields" alias="B" >
      <columnOverride column="wierd$Field" delimitedColumnName="true"/>
    </table>
    <table tableName="PKBlobs" />
    <table tableName="PKFieldsBlobs" />
    <table tableName="FieldsBlobs" />
    <table tableName="awful table" alias="A">
      <property name="useColumnIndexes" value="true"/>
      <generatedKey column="CuStOmEr iD" sqlStatement="HSQLDB" identity="true" />
      <columnOverride column="first name" property="firstFirstName" />
      <columnOverride column="first_name" property="secondFirstName" />
      <columnOverride column="firstName" property="thirdFirstName" />
      <columnOverride column="from" delimitedColumnName="true" />
      <columnOverride column="active" javaType="boolean" />
      <columnOverride column="_id1" delimitedColumnName="true" />
      <columnOverride column="$id2" delimitedColumnName="true" />
      <columnOverride column="id5_" delimitedColumnName="true" />
      <columnOverride column="id6$" delimitedColumnName="true" />
      <columnOverride column="id7$$" delimitedColumnName="true" />
      <columnOverride column="class" property="dbClass" />
    </table>
  </ibatorContext>

  <ibatorContext id="miscellaneousTests" targetRuntime="Ibatis2Java2">
    <ibatorPlugin type="org.mybatis.generator.plugins.EqualsHashCodePlugin" />

    <jdbcConnection driverClass="org.hsqldb.jdbcDriver"
        connectionURL="jdbc:hsqldb:mem:aname"
        userId="sa" />

    <javaModelGenerator targetPackage="mbg.test.ib2j2.generated.miscellaneous.model" targetProject="MAVEN">
      <property name="trimStrings" value="true" />
      <property name="rootClass" value="mbg.test.common.BaseClass" />
    </javaModelGenerator>

    <sqlMapGenerator targetPackage="mbg.test.ib2j2.generated.miscellaneous.xml"  targetProject="MAVEN">
    </sqlMapGenerator>

    <daoGenerator type="GENERIC-CI" targetPackage="mbg.test.ib2j2.generated.miscellaneous.dao"  targetProject="MAVEN">
      <property name="rootInterface" value="mbg.test.common.BaseInterface" />
      <property name="methodNameCalculator" value="EXTENDED"/>
    </daoGenerator>

    <table tableName="BlobsOnly" /> <!-- should generate a warning -->
    <table tableName="NonExistantTable" /> <!-- should generate a warning -->
    <table tableName="PKFields" domainObjectName="MyObject" alias="A" >
      <ignoreColumn column="fred" /> <!-- should generate a warning -->
      <ignoreColumn column="decimal30Field" />
      <columnOverride column="datefield" property="startDate"/>
      <columnOverride column="decimal155Field" javaType="java.lang.Double" />
      <columnOverride column="decimal60Field" javaType="int" />
      <columnOverride column="firstName" javaType="mbg.test.common.FirstName"
         typeHandler="mbg.test.ib2j2.common.FirstNameTypeHandler"/>
      <columnOverride column="timeField" javaType="mbg.test.common.MyTime"
         typeHandler="mbg.test.ib2j2.common.MyTimeTypeHandler"/>
      <columnOverride column="wierd$Field" delimitedColumnName="true"/>
    </table>
    <table tableName="RegexRename">
      <generatedKey column="CUST_ID" sqlStatement="call next value for TestSequence" type="pre" />
      <columnRenamingRule searchString="^CUST" />
    </table>
  </ibatorContext>
</ibatorConfiguration>
