<?xml version="1.0" encoding="UTF-8"?>
<!DOCTYPE ibatorConfiguration
  PUBLIC "-//Apache Software Foundation//DTD Apache iBATIS Ibator Configuration 1.0//EN"
  "http://ibatis.apache.org/dtd/ibator-config_1_0.dtd">

<ibatorConfiguration>
  
  <ibatorContext id="FlatJava2" targetRuntime="Ibatis2Java2" defaultModelType="flat">
    <ibatorPlugin type="org.apache.ibatis.ibator.plugins.EqualsHashCodePlugin" />
    <ibatorPlugin type="org.apache.ibatis.ibator.plugins.SqlMapConfigPlugin" >
      <property name="targetPackage" value="ibatortest.java2.generated.flat" />
      <property name="targetProject" value="${generated.source.dir.java2}" />
    </ibatorPlugin>
    
    <jdbcConnection driverClass="org.hsqldb.jdbcDriver"
        connectionURL="jdbc:hsqldb:mem:aname"
        userId="sa" />

    <javaModelGenerator targetPackage="ibatortest.java2.generated.flat.java2.model" targetProject="${generated.source.dir.java2}">
      <property name="enableSubPackages" value="true" />
      <property name="trimStrings" value="true" />
    </javaModelGenerator>

    <sqlMapGenerator targetPackage="ibatortest.java2.generated.flat.java2.xml"  targetProject="${generated.source.dir.java2}">
      <property name="enableSubPackages" value="true" />
    </sqlMapGenerator>

    <daoGenerator type="GENERIC-SI" targetPackage="ibatortest.java2.generated.flat.java2.dao"  targetProject="${generated.source.dir.java2}">
      <property name="enableSubPackages" value="true" />
    </daoGenerator>

    <table tableName="FieldsOnly" />
    <table tableName="PKOnly" />
    <table tableName="PKFields" alias="B" />
    <table tableName="PKBlobs" />
    <table tableName="PKFieldsBlobs" />
    <table tableName="FieldsBlobs" />
    <table tableName="awful table" alias="A">
      <property name="useColumnIndexes" value="true"/>
      <generatedKey column="CuStOmEr iD" sqlStatement="HSQLDB" identity="true" />
      <columnOverride column="customer id" property="secondCustomerId" />
      <columnOverride column="first name" property="firstFirstName" />
      <columnOverride column="First Name" property="secondFirstName" />
      <ignoreColumn column="first Name" />
      <columnOverride column="first_name" property="thirdFirstName" />
      <columnOverride column="firstName" property="fourthFirstName" />
      <columnOverride column="from" delimitedColumnName="true" />
      <columnOverride column="active" javaType="boolean" />
    </table>
  </ibatorContext>

  <ibatorContext id="HierarchicalJava2" targetRuntime="Ibatis2Java2" defaultModelType="hierarchical">
    <ibatorPlugin type="org.apache.ibatis.ibator.plugins.EqualsHashCodePlugin" />

    <jdbcConnection driverClass="org.hsqldb.jdbcDriver"
        connectionURL="jdbc:hsqldb:mem:aname"
        userId="sa" />

    <javaModelGenerator targetPackage="ibatortest.java2.generated.hierarchical.java2.model" targetProject="${generated.source.dir.java2}">
      <property name="enableSubPackages" value="true" />
      <property name="trimStrings" value="true" />
    </javaModelGenerator>

    <sqlMapGenerator targetPackage="ibatortest.java2.generated.hierarchical.java2.xml"  targetProject="${generated.source.dir.java2}">
      <property name="enableSubPackages" value="true" />
    </sqlMapGenerator>

    <daoGenerator type="GENERIC-CI" targetPackage="ibatortest.java2.generated.hierarchical.java2.dao"  targetProject="${generated.source.dir.java2}">
      <property name="enableSubPackages" value="true" />
    </daoGenerator>

    <table tableName="FieldsOnly" />
    <table tableName="PKOnly" />
    <table tableName="PKFields" alias="B" />
    <table tableName="PKBlobs" />
    <table tableName="PKFieldsBlobs" />
    <table tableName="FieldsBlobs" />
    <table tableName="awful table" alias="A">
      <property name="useColumnIndexes" value="true"/>
      <generatedKey column="CuStOmEr iD" sqlStatement="HSQLDB" identity="true" />
      <columnOverride column="customer id" property="secondCustomerId" />
      <columnOverride column="first name" property="firstFirstName" />
      <columnOverride column="First Name" property="secondFirstName" />
      <ignoreColumn column="first Name" />
      <columnOverride column="first_name" property="thirdFirstName" />
      <columnOverride column="firstName" property="fourthFirstName" />
      <columnOverride column="from" delimitedColumnName="true" />
      <columnOverride column="active" javaType="boolean" />
    </table>
  </ibatorContext>

  <ibatorContext id="ConditionalJava2" targetRuntime="Ibatis2Java2" defaultModelType="conditional">
    <ibatorPlugin type="org.apache.ibatis.ibator.plugins.EqualsHashCodePlugin" />

    <jdbcConnection driverClass="org.hsqldb.jdbcDriver"
        connectionURL="jdbc:hsqldb:mem:aname"
        userId="sa" />

    <javaModelGenerator targetPackage="ibatortest.java2.generated.conditional.java2.model" targetProject="${generated.source.dir.java2}">
      <property name="enableSubPackages" value="true" />
      <property name="trimStrings" value="true" />
    </javaModelGenerator>

    <sqlMapGenerator targetPackage="ibatortest.java2.generated.conditional.java2.xml"  targetProject="${generated.source.dir.java2}">
      <property name="enableSubPackages" value="true" />
    </sqlMapGenerator>

    <daoGenerator type="SPRING" targetPackage="ibatortest.java2.generated.conditional.java2.dao"  targetProject="${generated.source.dir.java2}">
      <property name="enableSubPackages" value="true" />
    </daoGenerator>

    <table tableName="FieldsOnly" />
    <table tableName="PKOnly" />
    <table tableName="PKFields" alias="B" />
    <table tableName="PKBlobs" />
    <table tableName="PKFieldsBlobs" />
    <table tableName="FieldsBlobs" />
    <table tableName="awful table" alias="A">
      <property name="useColumnIndexes" value="true"/>
      <generatedKey column="CuStOmEr iD" sqlStatement="HSQLDB" identity="true" />
      <columnOverride column="customer id" property="secondCustomerId" />
      <columnOverride column="first name" property="firstFirstName" />
      <columnOverride column="First Name" property="secondFirstName" />
      <ignoreColumn column="first Name" />
      <columnOverride column="first_name" property="thirdFirstName" />
      <columnOverride column="firstName" property="fourthFirstName" />
      <columnOverride column="from" delimitedColumnName="true" />
      <columnOverride column="active" javaType="boolean" />
    </table>
  </ibatorContext>

  <ibatorContext id="miscellaneousTests" targetRuntime="Ibatis2Java2">
    <ibatorPlugin type="org.apache.ibatis.ibator.plugins.EqualsHashCodePlugin" />

    <jdbcConnection driverClass="org.hsqldb.jdbcDriver"
        connectionURL="jdbc:hsqldb:mem:aname"
        userId="sa" />

    <javaModelGenerator targetPackage="ibatortest.java2.generated.miscellaneous.model" targetProject="${generated.source.dir.java2}">
      <property name="trimStrings" value="true" />
      <property name="rootClass" value="ibatortest.java2.execute.miscellaneous.BaseClass" />
    </javaModelGenerator>

    <sqlMapGenerator targetPackage="ibatortest.java2.generated.miscellaneous.xml"  targetProject="${generated.source.dir.java2}">
    </sqlMapGenerator>

    <daoGenerator type="GENERIC-CI" targetPackage="ibatortest.java2.generated.miscellaneous.dao"  targetProject="${generated.source.dir.java2}">
      <property name="rootInterface" value="ibatortest.java2.execute.miscellaneous.BaseInterface" />
      <property name="methodNameCalculator" value="EXTENDED"/>
    </daoGenerator>

    <table tableName="BlobsOnly" /> <!-- should generate a warning -->
    <table tableName="NonExistantTable" /> <!-- should generate a warning -->
    <table tableName="PKFields" domainObjectName="MyObject" alias="A" >
      <ignoreColumn column="fred" /> <!-- should generate a warning -->
      <ignoreColumn column="decimal30Field" />
      <columnOverride column="datefield" property="startDate"/>
      <columnOverride column="decimal155Field" javaType="java.lang.Double" />
      <columnOverride column="decimal60Field" javaType="int" />
      <columnOverride column="firstName" javaType="ibatortest.java2.execute.miscellaneous.FirstName"
         typeHandler="ibatortest.java2.execute.miscellaneous.FirstNameTypeHandler"/>
      <columnOverride column="timeField" javaType="ibatortest.java2.execute.miscellaneous.MyTime"
         typeHandler="ibatortest.java2.execute.miscellaneous.MyTimeTypeHandler"/>
    </table>
  </ibatorContext>
</ibatorConfiguration>
